{
  "schema_version": "1.0",
  "id": "united-arab-emirates/dubai-marina",
  "city": "Dubai (Marina)",
  "country": "United Arab Emirates",
  "country_code": "AE",
  "metrics": {
    "home_price_1bed_usd": {
      "value": 462000,
      "unit": "USD",
      "as_of": "2026-05",
      "sources": [
        "globalpropertyguide",
        "numbeo",
        "web"
      ],
      "method": "cross-source-median",
      "confidence": "medium"
    },
    "home_price_2bed_usd": {
      "value": 735000,
      "unit": "USD",
      "as_of": "2026-05",
      "sources": [
        "globalpropertyguide",
        "numbeo",
        "web"
      ],
      "method": "cross-source-median",
      "confidence": "medium"
    },
    "home_price_3bed_usd": {
      "value": 1069000,
      "unit": "USD",
      "as_of": "2026-05",
      "sources": [
        "globalpropertyguide",
        "numbeo",
        "web"
      ],
      "method": "cross-source-median",
      "confidence": "medium"
    }
  },
  "provenance": {
    "compiled_by": "starter-2026.1",
    "compiled_at": "2026-05-31",
    "status": "published"
  }
}