{
  "schema_version": "1.0",
  "id": "hong-kong/hong-kong-island",
  "city": "Hong Kong Island",
  "country": "Hong Kong",
  "country_code": "HK",
  "metrics": {
    "home_price_1bed_usd": {
      "value": 782000,
      "unit": "USD",
      "as_of": "2026-05",
      "sources": [
        "globalpropertyguide",
        "numbeo",
        "web"
      ],
      "method": "cross-source-median",
      "confidence": "medium"
    },
    "home_price_2bed_usd": {
      "value": 936000,
      "unit": "USD",
      "as_of": "2026-05",
      "sources": [
        "globalpropertyguide",
        "numbeo",
        "web"
      ],
      "method": "cross-source-median",
      "confidence": "medium"
    },
    "home_price_3bed_usd": {
      "value": 1578000,
      "unit": "USD",
      "as_of": "2026-05",
      "sources": [
        "globalpropertyguide",
        "numbeo",
        "web"
      ],
      "method": "cross-source-median",
      "confidence": "medium"
    }
  },
  "provenance": {
    "compiled_by": "starter-2026.1",
    "compiled_at": "2026-05-31",
    "status": "published"
  },
  "coordinates": {
    "lat": 22.25346,
    "lng": 114.19097
  }
}
