{
  "schema_version": "1.0",
  "id": "central-african-republic/bangui",
  "city": "Bangui",
  "country": "Central African Republic",
  "country_code": "CF",
  "coordinates": {
    "lat": 4.37,
    "lng": 18.58
  },
  "metrics": {
    "home_price_1bed_usd": {
      "value": 25000,
      "unit": "USD",
      "as_of": "2026-06",
      "sources": [
        "model_estimate"
      ],
      "confidence": "low",
      "method": "regional-comparable estimate",
      "notes": "Numbeo price-per-m² for city-centre Bangui extrapolated to typical 1–3BR sizes with large uncertainty"
    },
    "home_price_2bed_usd": {
      "value": 40000,
      "unit": "USD",
      "as_of": "2026-06",
      "sources": [
        "model_estimate"
      ],
      "confidence": "low",
      "method": "regional-comparable estimate",
      "notes": "Numbeo price-per-m² for city-centre Bangui extrapolated to typical 1–3BR sizes with large uncertainty"
    },
    "home_price_3bed_usd": {
      "value": 55000,
      "unit": "USD",
      "as_of": "2026-06",
      "sources": [
        "model_estimate"
      ],
      "confidence": "low",
      "method": "regional-comparable estimate",
      "notes": "Numbeo price-per-m² for city-centre Bangui extrapolated to typical 1–3BR sizes with large uncertainty"
    },
    "income_tax_effective_low_pct": {
      "value": 14.2,
      "unit": "pct",
      "as_of": "2026-06",
      "sources": [
        "web"
      ],
      "confidence": "medium",
      "method": "effective rate at $30k/$75k/$150k gross (single filer)",
      "notes": "Effective income tax + employee social contributions, single filer; national rate"
    },
    "income_tax_effective_mid_pct": {
      "value": 17.8,
      "unit": "pct",
      "as_of": "2026-06",
      "sources": [
        "web"
      ],
      "confidence": "medium",
      "method": "effective rate at $30k/$75k/$150k gross (single filer)",
      "notes": "Effective income tax + employee social contributions, single filer; national rate"
    },
    "income_tax_effective_high_pct": {
      "value": 21.0,
      "unit": "pct",
      "as_of": "2026-06",
      "sources": [
        "web"
      ],
      "confidence": "medium",
      "method": "effective rate at $30k/$75k/$150k gross (single filer)",
      "notes": "Effective income tax + employee social contributions, single filer; national rate"
    }
  },
  "provenance": {
    "compiled_by": "hugo-capitals-2026-06",
    "compiled_at": "2026-06-08",
    "status": "published"
  }
}
