{
  "schema_version": "1.0",
  "id": "slovakia/zilina",
  "city": "Zilina",
  "country": "Slovakia",
  "country_code": "SK",
  "metrics": {
    "home_price_1bed_usd": {
      "value": 185000,
      "unit": "USD",
      "as_of": "2026-05",
      "sources": [
        "globalpropertyguide",
        "numbeo",
        "web"
      ],
      "method": "cross-source-median",
      "confidence": "medium"
    },
    "home_price_2bed_usd": {
      "value": 251000,
      "unit": "USD",
      "as_of": "2026-05",
      "sources": [
        "globalpropertyguide",
        "numbeo",
        "web"
      ],
      "method": "cross-source-median",
      "confidence": "medium"
    },
    "home_price_3bed_usd": {
      "value": 376500,
      "unit": "USD",
      "as_of": "2026-05",
      "sources": [
        "globalpropertyguide",
        "numbeo",
        "web"
      ],
      "method": "cross-source-median",
      "confidence": "medium"
    }
  },
  "provenance": {
    "compiled_by": "starter-2026.1",
    "compiled_at": "2026-05-31",
    "status": "published"
  },
  "coordinates": {
    "lat": 49.22347,
    "lng": 18.73931
  }
}
