{
  "schema_version": "1.0",
  "id": "greece/volos",
  "city": "Volos",
  "country": "Greece",
  "country_code": "GR",
  "metrics": {
    "home_price_1bed_usd": {
      "value": 117000,
      "unit": "USD",
      "as_of": "2026-05",
      "sources": [
        "globalpropertyguide",
        "numbeo",
        "web"
      ],
      "method": "cross-source-median",
      "confidence": "medium"
    },
    "home_price_2bed_usd": {
      "value": 146000,
      "unit": "USD",
      "as_of": "2026-05",
      "sources": [
        "globalpropertyguide",
        "numbeo",
        "web"
      ],
      "method": "cross-source-median",
      "confidence": "medium"
    },
    "home_price_3bed_usd": {
      "value": 215000,
      "unit": "USD",
      "as_of": "2026-05",
      "sources": [
        "globalpropertyguide",
        "numbeo",
        "web"
      ],
      "method": "cross-source-median",
      "confidence": "medium"
    }
  },
  "provenance": {
    "compiled_by": "starter-2026.1",
    "compiled_at": "2026-05-31",
    "status": "published"
  }
}