{
  "schema_version": "1.0",
  "id": "australia/darwin",
  "city": "Darwin",
  "country": "Australia",
  "country_code": "AU",
  "metrics": {
    "home_price_1bed_usd": {
      "value": 226000,
      "unit": "USD",
      "as_of": "2026-05",
      "sources": [
        "globalpropertyguide",
        "numbeo",
        "web"
      ],
      "method": "cross-source-median",
      "confidence": "medium"
    },
    "home_price_2bed_usd": {
      "value": 341000,
      "unit": "USD",
      "as_of": "2026-05",
      "sources": [
        "globalpropertyguide",
        "numbeo",
        "web"
      ],
      "method": "cross-source-median",
      "confidence": "medium"
    },
    "home_price_3bed_usd": {
      "value": 453000,
      "unit": "USD",
      "as_of": "2026-05",
      "sources": [
        "globalpropertyguide",
        "numbeo",
        "web"
      ],
      "method": "cross-source-median",
      "confidence": "medium"
    }
  },
  "provenance": {
    "compiled_by": "starter-2026.1",
    "compiled_at": "2026-05-31",
    "status": "published"
  },
  "coordinates": {
    "lat": -12.46044,
    "lng": 130.84105
  }
}
