{
  "schema_version": "1.0",
  "id": "niger/niamey",
  "city": "Niamey",
  "country": "Niger",
  "country_code": "NE",
  "coordinates": {
    "lat": 13.52,
    "lng": 2.12
  },
  "metrics": {
    "home_price_1bed_usd": {
      "value": 45000,
      "unit": "USD",
      "as_of": "2026-06",
      "sources": [
        "web"
      ],
      "confidence": "low",
      "method": "researched estimate (price/m² × typical size)",
      "notes": "Researched estimate $900/m² × typical size (50/78/105 m²), corrected from implausible prior value"
    },
    "home_price_2bed_usd": {
      "value": 70000,
      "unit": "USD",
      "as_of": "2026-06",
      "sources": [
        "web"
      ],
      "confidence": "low",
      "method": "researched estimate (price/m² × typical size)",
      "notes": "Researched estimate $900/m² × typical size (50/78/105 m²), corrected from implausible prior value"
    },
    "home_price_3bed_usd": {
      "value": 94000,
      "unit": "USD",
      "as_of": "2026-06",
      "sources": [
        "web"
      ],
      "confidence": "low",
      "method": "researched estimate (price/m² × typical size)",
      "notes": "Researched estimate $900/m² × typical size (50/78/105 m²), corrected from implausible prior value"
    },
    "income_tax_effective_low_pct": {
      "value": 0.0,
      "unit": "pct",
      "as_of": "2026-06",
      "sources": [
        "web"
      ],
      "confidence": "medium",
      "method": "effective rate at $30k/$75k/$150k gross (single filer)",
      "notes": "Effective income tax + employee social contributions, single filer; national rate"
    },
    "income_tax_effective_mid_pct": {
      "value": 0.0,
      "unit": "pct",
      "as_of": "2026-06",
      "sources": [
        "web"
      ],
      "confidence": "medium",
      "method": "effective rate at $30k/$75k/$150k gross (single filer)",
      "notes": "Effective income tax + employee social contributions, single filer; national rate"
    },
    "income_tax_effective_high_pct": {
      "value": 0.0,
      "unit": "pct",
      "as_of": "2026-06",
      "sources": [
        "web"
      ],
      "confidence": "medium",
      "method": "effective rate at $30k/$75k/$150k gross (single filer)",
      "notes": "Effective income tax + employee social contributions, single filer; national rate"
    },
    "cost_of_living_index": {
      "value": 34.5,
      "unit": "index_numbeo_nyc100",
      "as_of": "2026-07",
      "sources": [
        "numbeo"
      ],
      "confidence": "medium",
      "notes": "Numbeo Cost of Living Index, excl. rent, NYC=100"
    },
    "local_purchasing_power_index": {
      "value": 24.6,
      "unit": "index_numbeo_nyc100",
      "as_of": "2026-07",
      "sources": [
        "numbeo"
      ],
      "confidence": "medium",
      "notes": "Numbeo Local Purchasing Power Index, NYC=100"
    }
  },
  "provenance": {
    "compiled_by": "hugo-capitals-2026-06",
    "compiled_at": "2026-06-08",
    "status": "published"
  }
}
