{
  "schema_version": "1.0",
  "id": "fiji/suva",
  "city": "Suva",
  "country": "Fiji",
  "country_code": "FJ",
  "coordinates": {
    "lat": -18.13,
    "lng": 178.42
  },
  "metrics": {
    "home_price_1bed_usd": {
      "value": 70000,
      "unit": "USD",
      "as_of": "2026-06",
      "sources": [
        "model_estimate"
      ],
      "confidence": "low",
      "method": "regional-comparable estimate",
      "notes": "Numbeo city-centre price/sqm for Suva (~$678) scaled by typical 1–3BR sizes and cross-checked with Fiji residential market levels"
    },
    "home_price_2bed_usd": {
      "value": 110000,
      "unit": "USD",
      "as_of": "2026-06",
      "sources": [
        "model_estimate"
      ],
      "confidence": "low",
      "method": "regional-comparable estimate",
      "notes": "Numbeo city-centre price/sqm for Suva (~$678) scaled by typical 1–3BR sizes and cross-checked with Fiji residential market levels"
    },
    "home_price_3bed_usd": {
      "value": 150000,
      "unit": "USD",
      "as_of": "2026-06",
      "sources": [
        "model_estimate"
      ],
      "confidence": "low",
      "method": "regional-comparable estimate",
      "notes": "Numbeo city-centre price/sqm for Suva (~$678) scaled by typical 1–3BR sizes and cross-checked with Fiji residential market levels"
    },
    "cost_of_living_index": {
      "value": 51.0,
      "unit": "index_numbeo_nyc100",
      "as_of": "2026-06",
      "sources": [
        "numbeo"
      ],
      "confidence": "medium",
      "notes": "Numbeo Cost of Living Index, excl. rent, NYC=100"
    },
    "local_purchasing_power_index": {
      "value": 34.0,
      "unit": "index_numbeo_nyc100",
      "as_of": "2026-06",
      "sources": [
        "numbeo"
      ],
      "confidence": "medium",
      "notes": "Numbeo Local Purchasing Power Index, NYC=100"
    },
    "rent_1bed_usd_month": {
      "value": 637,
      "unit": "USD_per_month",
      "as_of": "2026-06",
      "sources": [
        "numbeo"
      ],
      "confidence": "medium",
      "notes": "Avg monthly rent, 1-bed city centre"
    },
    "rent_3bed_usd_month": {
      "value": 1609,
      "unit": "USD_per_month",
      "as_of": "2026-06",
      "sources": [
        "numbeo"
      ],
      "confidence": "medium",
      "notes": "Avg monthly rent, 3-bed city centre"
    },
    "price_to_rent_ratio": {
      "value": 7.8,
      "unit": "ratio",
      "as_of": "2026-06",
      "sources": [
        "model_estimate"
      ],
      "confidence": "medium",
      "method": "home_price_3bed_usd / (12 * rent_3bed_usd_month)",
      "notes": "Years of 3-bed rent to equal the 3-bed purchase price"
    }
  },
  "provenance": {
    "compiled_by": "hugo-capitals-2026-06",
    "compiled_at": "2026-06-08",
    "status": "published"
  }
}
